{ "schema":"covenantgate.policy.base.v1","version":1,"defaults":{"default_decision":"deny"},"allow_rules":[{"id":"allow.ingest.from.covenant","effect":"allow","enforcement_points":["ingest.packet"],"when":{"op":"eq","path":"/resource/packet/producer","value":"covenant-gate"},"reason_codes":["ALLOW_COVENANT_PRODUCER"]}],"deny_rules":[] }
